{
  "bettor_id": "ittetsu",
  "bettor_name": "一徹",
  "philosophy": "期待値プラスでも賭け金が規律に届かなければ買わない。見送りも投資判断。",
  "backend": "codex-gpt-5.5",
  "tickets": [],
  "total_stake_jpy": 0,
  "skipped_budget_jpy": 10000,
  "notes": [
    "単勝はEV=オッズ×win_probで評価。EV>1は5番1.353、14番1.268、10番1.468、6番1.007。",
    "1/4ケリーは f=0.25*((odds*p-1)/(odds-1))。予算10000円換算で5番約173円、14番約103円、10番約105円、6番約0円となり、いずれも最小購入300円未満。",
    "複勝はodds_place下限とplace_probを使って保守評価。提示place_probが下限近似で薄く、EV>1の候補なし。",
    "ワイド・馬連・三連複・三連単はHarville近似で着順確率を作り、馬連/ワイド22.5%、三連複25%、三連単27.5%の控除率を織り込む前提。ただし単勝で規律に届く厚いエッジがなく、組合せ券は推定誤差と控除で見送り。",
    "当日オッズ下落リスクを考慮し、ぎりぎりEVプラスやケリー額が購入単位に届かない券は買わない。全額見送り。"
  ]
}
