{
  "bettor_id": "kaede",
  "bettor_name": "楓",
  "philosophy": "単勝・複勝・ワイド・三連複を複数シナリオに分散し、どの決着でも壊滅しないポートフォリオを組む。",
  "backend": "claude-sonnet",
  "tickets": [
    {
      "bet_type": "単勝",
      "selection": "10",
      "stake_jpy": 1000,
      "rationale_short": "EV最大1.47。odds12.1倍 vs 損益分岐8.24倍で最大オーバーレイ。win_prob12.1%を市場が過小評価（市場含意8.3%）。"
    },
    {
      "bet_type": "単勝",
      "selection": "5",
      "stake_jpy": 700,
      "rationale_short": "EV1.35。odds6.1倍 vs 損益分岐4.51倍。win_prob22.2%最有力、6.1倍は明確に割安。本命決着の主軸。"
    },
    {
      "bet_type": "単勝",
      "selection": "14",
      "stake_jpy": 500,
      "rationale_short": "EV1.27。odds7.5倍 vs 損益分岐5.91倍。win_prob16.9%に対し市場が軽視。5飛び時の主役候補。"
    },
    {
      "bet_type": "複勝",
      "selection": "5",
      "stake_jpy": 500,
      "rationale_short": "Harville推定複勝確率46%、odds中央値2.8倍→EV≈1.29。単勝不的中でも複勝圏確保の安定回収源。"
    },
    {
      "bet_type": "複勝",
      "selection": "10",
      "stake_jpy": 400,
      "rationale_short": "Harville推定複勝確率29%、odds中央値4.2倍→EV≈1.22。単勝割安効果が複勝にも波及。10連動カバー。"
    },
    {
      "bet_type": "ワイド",
      "selection": "5-10",
      "stake_jpy": 500,
      "rationale_short": "EV上位2頭が同時入着。Harville推定同時複勝圏確率14%、fair odds≈5.4倍以上で正EV圏。"
    },
    {
      "bet_type": "ワイド",
      "selection": "5-14",
      "stake_jpy": 400,
      "rationale_short": "最有力2頭クロス。Harville推定同時複勝圏確率19%、fair odds≈4.1倍。本命決着の安定回収軸。"
    },
    {
      "bet_type": "ワイド",
      "selection": "10-14",
      "stake_jpy": 300,
      "rationale_short": "バリュー2頭クロス。Harville推定同時複勝圏確率11%、fair odds≈6.9倍。5が飛んだ際のメインカバー。"
    },
    {
      "bet_type": "三連複",
      "selection": "5-10-14",
      "stake_jpy": 400,
      "rationale_short": "Harville P≈5.1%、控除後期待配当≈14.8倍。バリュー3頭ワンツースリー。中心シナリオ最高配当狙い。"
    },
    {
      "bet_type": "三連複",
      "selection": "5-11-14",
      "stake_jpy": 300,
      "rationale_short": "Harville P≈5.5%、控除後期待配当≈13.7倍。11は単勝EV低いが複勝圏期待大。11絡み波乱カバー。"
    },
    {
      "bet_type": "三連複",
      "selection": "5-10-11",
      "stake_jpy": 300,
      "rationale_short": "Harville P≈3.7%、控除後期待配当≈20.4倍。10と11が共存し14が飛ぶシナリオ。上位混戦カバー。"
    },
    {
      "bet_type": "三連複",
      "selection": "5-8-14",
      "stake_jpy": 300,
      "rationale_short": "Harville P≈2.6%、控除後期待配当≈29倍。穴馬8(win_prob6.6%)絡み中穴シナリオ。最小額で波乱保険。"
    }
  ],
  "total_stake_jpy": 5600,
  "skipped_budget_jpy": 4400,
  "notes": [
    "【Harville近似の前提】P(j 2nd|i 1st)=p_j/(1-p_i)、P(k 3rd|i,j out)=p_k/(1-p_i-p_j)。三連複は6通り順列の合算。各券種の控除率：単複20%、ワイド22.5%、三連複25%。",
    "【place_prob補正】入力place_probは下限近似のため、Harville式 3p/(1+2p) で独自推定: 馬5≈46%、馬14≈38%、馬11≈31%、馬10≈29%、馬8≈18%。複勝EV算出はこの推定値を使用。",
    "【単勝EV一覧】馬10: 12.1×0.1213=1.468（最大オーバーレイ、市場含意8.3%に対し集約12.1%）; 馬5: 6.1×0.2218=1.353; 馬14: 7.5×0.1691=1.268。いずれも控除後でも正EV。",
    "【馬11（エコロアルバ）の単複回避理由】win_prob13.0%に対しodds4.0倍（損益分岐7.67倍）→単勝EV0.52、複勝EV≈0.64。単独券は組まず三連複のみ採用（絡む可能性自体は高い）。",
    "【馬8・その他穴馬】サイルーン(win_prob6.6%)はodds8.1倍(損益分岐15.1倍)でEV0.54。単勝は見送り。三連複5-8-14で最小額300円の波乱保険のみ。",
    "【ワイドオッズ未取得】meta.wide_oddsが未提供のため自前推定。ワイドfair odds（控除後）: 5-14≈4.1倍、5-10≈5.4倍、10-14≈6.9倍。発走前に実オッズを確認し、5-14が3倍未満・5-10が4倍未満・10-14が6倍未満の場合は各券を見送り推奨。",
    "【当日オッズ確認推奨】取得時刻09:44、発走15:30。馬10が9倍以下に急落した場合は単勝比率を下げること。馬5が4倍台に落ちた場合は損益分岐4.51倍を下回るため単勝見送りを検討。",
    "【三連複推定確率・期待配当】5-10-14: P=5.06%、期待配当≈14.8倍; 5-11-14: P=5.50%、期待配当≈13.7倍; 5-10-11: P=3.68%、期待配当≈20.4倍; 5-8-14: P=2.58%、期待配当≈29.1倍（全てHarville近似・控除25%反映）。",
    "【最悪ケース（全外れ時）】最大損失=5,600円（予算の56%）。残4,400円は見送り。馬場急変・騎乗変更等が生じた場合はポートフォリオ全体を無効とすること（meta.track_assumption参照）。"
  ]
}
