{"bettor_id":"ittetsu","bettor_name":"一徹","philosophy":"期待値プラスでも賭け金が規律に届かなければ買わない。見送りも投資判断。","backend":"codex-gpt-5.5","tickets":[],"total_stake_jpy":0,"skipped_budget_jpy":10000,"notes":["良馬場前提。稍重以下なら無効。","単勝16はbet365基準EV=1.051だが1/4ケリー約26円で最小300円未満、かつ当日下落リスクあり。","単勝18はEV=1.117だが1/4ケリー約2円で最小300円未満。","他の単勝はEV<1.0。複勝・ワイド・三連系もHarville近似と控除後で購入規律に届かない。"]}