{
  "bettor_id": "go",
  "bettor_name": "剛",
  "philosophy": "◎軸の三連複フォーメーションで面を取る攻撃派。確率の裏付けがある中穴まで攻め、闇雲な大穴は買わない。",
  "backend": "claude-opus",
  "tickets": [
    {
      "bet_type": "三連複",
      "selection": "5-11-14",
      "stake_jpy": 1000,
      "rationale_short": "軸5×上位2頭の背骨。Harville P≈5.5%/最高的中率。推定配当≈13.7倍→1点13,710円で全額超過回収。"
    },
    {
      "bet_type": "三連複",
      "selection": "5-10-14",
      "stake_jpy": 1000,
      "rationale_short": "軸5×14×中穴10(12.1倍)。P≈5.0%、推定配当≈14.9倍→14,880円。面の主力。"
    },
    {
      "bet_type": "三連複",
      "selection": "5-10-11",
      "stake_jpy": 800,
      "rationale_short": "軸5×11×10。P≈3.7%、推定配当≈20.4倍→16,296円。上位3頭絡みの本線。"
    },
    {
      "bet_type": "三連複",
      "selection": "5-8-14",
      "stake_jpy": 700,
      "rationale_short": "軸5×14×中穴8(8.1倍/6.6%)。P≈2.6%、推定配当≈29倍→20,328円。"
    },
    {
      "bet_type": "三連複",
      "selection": "5-8-11",
      "stake_jpy": 600,
      "rationale_short": "軸5×11×8。P≈1.9%、推定配当≈39.7倍→23,844円。中穴トリオで配当を取る。"
    },
    {
      "bet_type": "三連複",
      "selection": "5-8-10",
      "stake_jpy": 600,
      "rationale_short": "軸5×10×8。P≈1.7%、推定配当≈43.2倍→25,920円。"
    },
    {
      "bet_type": "三連複",
      "selection": "5-9-14",
      "stake_jpy": 500,
      "rationale_short": "軸5×14×中穴9(10.6倍/4.6%)。P≈1.7%、推定配当≈43倍→21,580円。"
    },
    {
      "bet_type": "三連複",
      "selection": "5-9-11",
      "stake_jpy": 500,
      "rationale_short": "軸5×11×9。P≈1.3%、推定配当≈59倍→29,540円。"
    },
    {
      "bet_type": "三連複",
      "selection": "5-9-10",
      "stake_jpy": 400,
      "rationale_short": "軸5×10×9。P≈1.2%、推定配当≈63倍→25,240円。"
    },
    {
      "bet_type": "三連複",
      "selection": "5-8-9",
      "stake_jpy": 300,
      "rationale_short": "軸5×中穴8×9。P≈0.6%、推定配当≈125倍→37,470円。フォーメーション端の一発。"
    }
  ],
  "total_stake_jpy": 6400,
  "skipped_budget_jpy": 3600,
  "notes": [
    "三連複フォーメーション：軸=5ファーヴェント(win_prob最上位0.2218)、相手={14,11,10,8,9}から2頭選択のC(5,2)=10点。軸5は単勝EVが薄い(odds6.1<損益分岐4.51の逆数換算で割安感薄)ため単勝では買わず三連複の背骨に使用。",
    "相手選定：2-3番手の14(7.5倍/16.9%)・11(4.0倍/13.0%)、確率の裏付けある中穴10(12.1倍/12.1%)・8(8.1倍/6.6%)・9(10.6倍/4.6%)。15倍超かつplace薄の12・大穴勢は『中穴まで』の原則で除外し予算温存。",
    "配当推定：当日の三連複オッズ・ワイドオッズは入力に無いため自前推定。集約win_probを各馬の1着確率とし、Harville近似(p_a・p_b/(1-p_a)・p_c/(1-p_a-p_b))で全6順序確率を合算→トリオ的中確率Pを算出。fair_odds=1/P、控除率0.25を引いた payout≈fair_odds×0.75 を概算配当とした。",
    "設計：全10点いずれの単独的中でも推定払戻が投資総額6,400円を上回る（最小でも5-11-14の約13,710円）。本線(5-11-14/5-10-14/5-10-11)で的中率、中穴トリオ(8・9絡み)で配当を狙う。",
    "Harville近似は確率の独立性を仮定する簡易法で実配当とは乖離しうる。良馬場前提・当日09:44時点オッズ基準。馬場急変時は本ポートフォリオ無効。購入可否の最終判断はShoに委ねる。"
  ]
}
