{"bettor_id":"ittetsu","bettor_name":"一徹","philosophy":"期待値プラスでも賭け金が規律に届かなければ買わない。見送りも投資判断。","backend":"codex-gpt-5.5","tickets":[{"bet_type":"単勝","selection":"5","stake_jpy":300,"rationale_short":"EV=6.1×0.2893=1.765。1/4ケリー約375円を下落リスク込みで300円に抑制。"}],"total_stake_jpy":300,"skipped_budget_jpy":9700,"notes":["単勝は EV=オッズ×win_prob、ケリー f=(b*p-q)/b、b=オッズ-1、q=1-p、1/4ケリーで算出。100円単位かつ最小300円制約。","5番の単勝のみEVが十分に1.0を上回り、1/4ケリー賭け金が購入規律300円に到達した。","6番単勝はEV=1.019と僅かにプラスだが、1/4ケリー賭け金が300円に遠く届かず、当日オッズ下落リスクもあるため見送り。","複勝は odds_place が null のため実オッズでEV検証不可。ワイド・馬連・三連系はHarville近似で的中確率を作れるが、実市場オッズ未取得のため購入対象外。","Harville近似は win_prob を着順条件付き確率へ再正規化し、馬連・ワイド・三連複・三連単の組合せ確率を推定する前提。控除率は馬連・ワイド22.5%、三連複25%、三連単27.5%を想定。","馬場前提は良。馬場急変または単勝5番が大きく下落しEV優位が消える場合、この配分は無効。"]}
