{
  "bettor_id": "go",
  "bettor_name": "剛",
  "philosophy": "軸#5を背骨に三連複フォーメーションを展開。本線で的中率を、中穴#17/#1絡みで配当を稼ぐ。確率の裏付けがある中穴止まり、闇雲な大穴は買わない。",
  "backend": "claude-opus",
  "tickets": [
    {
      "bet_type": "単勝",
      "selection": "16",
      "stake_jpy": 600,
      "rationale_short": "唯一の正EV単勝(win17.5%×6.0倍=EV1.05)。タバルは過小評価、軸不発時の独立保険"
    },
    {
      "bet_type": "三連複",
      "selection": "2-5-16",
      "stake_jpy": 1200,
      "rationale_short": "本線。上位3頭でP=13.0%最大。配当は薄い(概算5.8倍)が的中率の柱"
    },
    {
      "bet_type": "三連複",
      "selection": "2-5-17",
      "stake_jpy": 900,
      "rationale_short": "軸+M.マイル+レガレイラ。中穴#17絡みP=6.1%、概算12倍ゾーン"
    },
    {
      "bet_type": "三連複",
      "selection": "1-2-5",
      "stake_jpy": 900,
      "rationale_short": "軸+M.マイル+ダノン。#1絡みP=6.0%、概算12.5倍"
    },
    {
      "bet_type": "三連複",
      "selection": "1-5-16",
      "stake_jpy": 900,
      "rationale_short": "軸+タバル+ダノン。P=5.8%、概算12.9倍。本線の裏目を埋める"
    },
    {
      "bet_type": "三連複",
      "selection": "5-16-17",
      "stake_jpy": 900,
      "rationale_short": "軸+タバル+レガレイラ。P=6.0%、概算12.6倍。中穴2方向をカバー"
    },
    {
      "bet_type": "三連複",
      "selection": "1-5-17",
      "stake_jpy": 700,
      "rationale_short": "中穴本線。軸+ダノン+レガレイラ。P=2.7%だが概算27倍の回収核"
    },
    {
      "bet_type": "ワイド",
      "selection": "1-17",
      "stake_jpy": 400,
      "rationale_short": "中穴2頭ワイド。両者top3でP=6.4%、概算12倍。軸が崩れても拾える保険"
    },
    {
      "bet_type": "複勝",
      "selection": "16",
      "stake_jpy": 700,
      "rationale_short": "タバルtop3 P=52%、概算1.53倍。三連複が外れても元を一部回収する床"
    }
  ],
  "total_stake_jpy": 7200,
  "skipped_budget_jpy": 2800,
  "notes": [
    "良馬場前提。稍重以下に悪化した場合このポートフォリオは無効(入力JSONの前提を踏襲)。",
    "配当が判明する単勝・複勝・ワイドは win_odds_bet365(6/10固定)を使用。組み合わせ券(三連複)の配当は不明のため、win_prob のHarville近似でtop3順序確率を全6通り合算し、控除率(三連複0.25)を差し引いた fair_odds×(1-0.25) を概算payoutとした。",
    "三連複の概算payout: 2-5-16≈5.8倍, 2-5-17≈12.3倍, 1-2-5≈12.5倍, 1-5-16≈12.9倍, 5-16-17≈12.6倍, 1-5-17≈27.4倍。実配当はオッズ歪み(人気馬の過剰投票)でこれより跳ねる可能性が高くupside側。",
    "軸は#5クロワデュノール(win29.9%/top3 71.8%)。ただし単勝2.4倍はEVマイナス(0.72)のため単勝では買わず、三連複7点すべての背骨として活用。",
    "相手は2番手#2/#16(win~17.5%)と中穴#17レガレイラ/#1ダノン(win~9%, 単勝9〜10倍)。三連複7点で軸+{2,16,17,1}の主要トリオを面で押さえた。",
    "大穴は見送り: #15/#6絡み三連複は概算40倍超だがP=1.8%前後と薄く、win_prob由来のplace_lbも低い。『確率の裏付けがある中穴まで』の原則で除外し、2800円を温存(skipped)。",
    "ハーネス内EV概算: 総期待戻り~6080円/投資7200円。控除率の壁で1.0は超えないが、中穴トリオ的中時(1-5-17等)に1点で投資全額を超過回収する設計。",
    "selection表記はワイド昇順(1-17)、三連複昇順(例 2-5-16)で統一。単勝・複勝は馬番単体。"
  ]
}
