{
  "bettor_id": "ritsu",
  "bettor_name": "律",
  "philosophy": "回収率の規律派。市場オッズと集約確率の乖離が小さく、損益分岐オッズを5%上回る条件を満たす買い目がないため見送ります。",
  "backend": "gemini-2.5-flash",
  "tickets": [],
  "total_stake_jpy": 0,
  "skipped_budget_jpy": 10000,
  "notes": [
    "市場オッズ（最も保守的な値）が、当エージェントの算出する損益分岐オッズに5%の安全マージンを加えた値を上回る買い目が単勝・複勝ともに存在しないため、全ての買い目を見送りました。買わないことも立派な戦略です。"
  ]
}
