{
  "bettor_id": "ritsu",
  "bettor_name": "律",
  "philosophy": "損益分岐オッズ×1.05 を下回る賭けを拒否する回収率規律派。",
  "backend": "gemini-2.5-flash",
  "tickets": [
    {
      "bet_type": "単勝",
      "selection": "5",
      "stake_jpy": 3000,
      "rationale_short": "勝率22.18%で損益分岐オッズ4.51に対し、当日単勝オッズ6.1倍と安全マージン5%超をクリア。"
    },
    {
      "bet_type": "単勝",
      "selection": "14",
      "stake_jpy": 2000,
      "rationale_short": "勝率16.91%で損益分岐オッズ5.91に対し、当日単勝オッズ7.5倍と安全マージン5%超をクリア。"
    },
    {
      "bet_type": "単勝",
      "selection": "10",
      "stake_jpy": 2000,
      "rationale_short": "勝率12.13%で損益分岐オッズ8.24に対し、当日単勝オッズ12.1倍と安全マージン5%超をクリア。"
    }
  ],
  "total_stake_jpy": 7000,
  "skipped_budget_jpy": 3000,
  "notes": [
    "本ポートフォリオは、各馬の集約勝率(win_prob)および集約複勝率(place_prob)から損益分岐オッズ（1/P）を算出し、5%の安全マージン（1/P * 1.05）を乗じた基準を用いています。",
    "当日オッズの最も保守的な値（単勝はodds_win、複勝はodds_placeの下限）がこの安全基準を上回る買い目のみを採用しました。",
    "複勝については、place_probの下限近似に基づく損益分岐オッズ（安全マージン込）に対し、市場オッズの下限が大幅に下回ったため、規律に基づきすべて見送りとしました。",
    "連勝式（ワイド・馬連・三連複・三連単）についても、控除率が重く、かつHarville近似で算出した合成確率が安全基準をクリアできなかったため、一切購入しませんでした。",
    "基準をクリアした単勝3点（5, 14, 10）に期待値（エッジ）を考慮しつつ合計7,000円を適切に配分し、残る3,000円は無駄なリスクを避けるため投資を見送りました。"
  ]
}
