{
  "bettor_id": "kaede",
  "bettor_name": "楓",
  "philosophy": "単勝・複勝・ワイド・三連複を3シナリオに分散し、どの決着でも壊滅しないポートフォリオ",
  "backend": "claude-sonnet",
  "tickets": [
    {
      "bet_type": "複勝",
      "selection": "5",
      "stake_jpy": 1000,
      "rationale_short": "本命軸。place_prob 58.8%と最高値。シナリオA・C両方で基盤回収を担う安全弁"
    },
    {
      "bet_type": "単勝",
      "selection": "5",
      "stake_jpy": 700,
      "rationale_short": "bet365 2.4倍はbreakeven 3.35を下回るが最大win_prob 29.9%を持つ本命。軸単勝で上乗せ"
    },
    {
      "bet_type": "複勝",
      "selection": "2",
      "stake_jpy": 500,
      "rationale_short": "2番ミュージアムマイル。place_prob 44.4%、シナリオB（5番飛び）での主力回収"
    },
    {
      "bet_type": "複勝",
      "selection": "16",
      "stake_jpy": 500,
      "rationale_short": "16番メイショウタバル。place_prob 44.3%、breakeven 5.71 vs bet365 6.0でわずかに期待値プラス"
    },
    {
      "bet_type": "ワイド",
      "selection": "5-16",
      "stake_jpy": 700,
      "rationale_short": "本命1-2番手コンビ。Harville近似でplace_prob積≈26%。シナリオA最頻出ペア"
    },
    {
      "bet_type": "ワイド",
      "selection": "2-5",
      "stake_jpy": 500,
      "rationale_short": "1・2番手コンビ。win_prob合計47.8%の上位2頭。シナリオA本命決着の複線"
    },
    {
      "bet_type": "ワイド",
      "selection": "2-16",
      "stake_jpy": 500,
      "rationale_short": "シナリオB核。5番が飛んだ時の2-3番手コンビ。win_prob合計35.4%で信頼性高い"
    },
    {
      "bet_type": "ワイド",
      "selection": "5-17",
      "stake_jpy": 500,
      "rationale_short": "シナリオC波乱保険。17番レガレイラwin_prob 9.2%、市場オッズ9倍で期待値やや厚め"
    },
    {
      "bet_type": "三連複",
      "selection": "2-5-16",
      "stake_jpy": 1500,
      "rationale_short": "シナリオA本命。Harville 6順列合計P≈15.6%。控除後期待配当≈4.8倍。最重点張り"
    },
    {
      "bet_type": "三連複",
      "selection": "1-5-16",
      "stake_jpy": 500,
      "rationale_short": "1番ダノンデサイルwin_prob 9.1%を軸に絡める。本命3頭がわずかに変わる準本命ライン"
    },
    {
      "bet_type": "三連複",
      "selection": "5-16-17",
      "stake_jpy": 500,
      "rationale_short": "シナリオC中波乱。17番レガレイラ絡み。Harville推定P≈6.1%、高配当期待で少額抑え"
    },
    {
      "bet_type": "三連複",
      "selection": "2-16-17",
      "stake_jpy": 500,
      "rationale_short": "シナリオB波乱。5番飛び時に2-16-17が台頭するケース。少額で押さえ"
    }
  ],
  "total_stake_jpy": 8400,
  "skipped_budget_jpy": 1600,
  "notes": [
    "【Harville近似の前提】三連複確率はHarvilleモデル（P(A)×P(B|¬A)×P(C|¬A¬B)）で全6順列を合計。分母は残馬win_prob合計で正規化。",
    "【控除率】三連複25%適用。期待配当 = (1 - 0.25) / P で算出。三連複2-5-16: P≈0.156→期待配当≈4.8倍（500円で2,400円相当）。",
    "【ワイド配当推定】Harville place確率の積×補正係数で近似。市場の歪み（bet365固定オッズ）は反映しない。",
    "【シナリオA：本命決着（2-5-16圏内）】回収見込み: 複勝5(1,500)+複勝2(750)+複勝16(750)+ワイド5-16(2,100)+ワイド2-5(1,250)+三連複2-5-16(7,200)+単勝5(1,680)≈15,230円。投資8,400円に対し+6,830円（推定配当は仮定値）。",
    "【シナリオB：5番飛び（2・16中心）】複勝2(750)+複勝16(750)+ワイド2-16(2,500)+三連複2-16-17(10,000)≈14,000円。単勝・複勝5等は外れ。投資8,400円に対し概算+5,600円（三連複配当は高ブレ前提）。",
    "【シナリオC：波乱（17番・1番絡み）】ワイド5-17(4,000)+三連複5-16-17(15,000)+複勝5(1,500)≈20,500円。投資8,400円に対し概算+12,100円（高配当仮定）。",
    "【最悪ケース】全12点外れ: -8,400円。予算10,000円に対し84%の損失リスク。",
    "【5番bet365過小評価に注意】bet365 2.4倍はbreakeven 3.35を大幅に下回る。JRA当日オッズが3倍以上なら単勝期待値改善。当日オッズ確認を推奨。",
    "【馬場悪化免責】meta.track_assumption通り、稍重以下ではこのポートフォリオは無効。当日朝に馬場状態を確認すること。",
    "【残り1,600円の見送り理由】12点上限到達のため消化。追加候補は単勝2番（期待値やや不足）で見送り。"
  ]
}
